{
  "agent": {
    "agent_id": "agt_aip_assistant_20260801_prod",
    "build_hash": "sha256:4c810230ff7189ac2d6f8d8727be1da15cbbfdb3eef357710d95e3c998dc5da0",
    "format": "AFSP",
    "operator_id": "clo_ai_platform_001"
  },
  "behavioral": {
    "ecl": {
      "evaluated": true,
      "geographic_risk_tier": 1,
      "out_of_band_required": false,
      "step_up_required": false
    },
    "form": "COMPOSITE",
    "score": 0.894,
    "signal_types_contributing": [
      "TOUCH_PATTERNS",
      "DEVICE_MOTION",
      "NAVIGATION_TIMING",
      "DEVICE_HARDWARE"
    ]
  },
  "checks": [
    {
      "id": "STRUCTURE",
      "status": "PASS"
    },
    {
      "id": "VAL-04a",
      "status": "PASS"
    },
    {
      "id": "VAL-01",
      "status": "PASS"
    },
    {
      "id": "VAL-02",
      "status": "PASS"
    },
    {
      "id": "VAL-03",
      "status": "PASS"
    },
    {
      "id": "VAL-04",
      "status": "PASS"
    },
    {
      "id": "VAL-05",
      "status": "PASS"
    },
    {
      "id": "VAL-06",
      "status": "PASS"
    },
    {
      "id": "VAL-07",
      "status": "PASS"
    },
    {
      "id": "VAL-08",
      "status": "PASS"
    },
    {
      "id": "VAL-08a",
      "status": "PASS"
    },
    {
      "id": "REF-01",
      "status": "PASS"
    },
    {
      "code": "malformed",
      "detail": "S4: unknown field `account_balance_usd`, expected one of `account_longevity`, `income_stability`, `balance_range`, `transaction_regularity`, `relationship_breadth`, `product_eligibility`",
      "id": "VAL-09",
      "status": "FAIL"
    },
    {
      "id": "VAL-10",
      "status": "PASS"
    }
  ],
  "consumer": {
    "action_classes": [
      "READ",
      "DISCOVER",
      "PRESENT",
      "INITIATE"
    ],
    "authorization_token_hash": "sha256:c068af08f32c622a3d488553244444af4641cd0b1c66ca16496032c62bf13227",
    "authorizing_tier": 2,
    "consumer_device_id": "dev_9f3a1c2e4b5d6f7a8b9c0d1e2f3a4b5c",
    "format": "AFSP",
    "issuing_institution_id": "harbor_federal_afsp_001",
    "participation_state": "EXPANDED_SCOPE",
    "product_categories": [
      "SAVINGS",
      "MMA"
    ],
    "root_key_thumbprint": "pRsqMiP5GSIJbvBfRJKpgfqiJDZ3eUD0TKhqLhddvhE",
    "servicing_intent": {
      "action_class": "INITIATE",
      "action_type": "ACCOUNT_OPENING",
      "afsp_version": "0.1",
      "amount": null,
      "authorization_tier": "Authorization Tier 2 (INITIATE)",
      "currency": "USD",
      "generated_from_structured_fields": true,
      "ivc_confirmation_timestamp": "2026-08-18T14:24:12Z",
      "ivc_confirmed": true,
      "ivc_display_text": "Open a High-Yield Savings Account at Sunrise Digital Bank? APY 5.10%, no monthly fee, $100 minimum balance, FDIC-insured.",
      "package_type": "SERVICING_INTENT_PACKAGE",
      "product": "High-Yield Savings Account",
      "product_terms": {
        "apy": "5.10%",
        "deposit_insurer": "FDIC",
        "minimum_balance": "100.00",
        "monthly_fee": "0.00"
      },
      "receiving_institution": "Sunrise Digital Bank",
      "receiving_institution_id": "sunrise_digital_bank_afsp_001",
      "session_id": "sess_2e4f6a8c0b2d4f6a",
      "timing": "immediate"
    }
  },
  "outcome": "PACKAGE_REJECTED",
  "package_id": "pkg_1a3c5e7f9b2d4f6a8c0e2b4d6f8a0c2e4b6d8f0a1c3e5a7c9e1b3d5f7a9c1e3b",
  "referral": {
    "kyc_program": "CIP_STANDARD",
    "kyc_verified_on": "2026-02",
    "referring_institution_id": "harbor_federal_afsp_001"
  },
  "session_id": "sess_2e4f6a8c0b2d4f6a",
  "signals_present": [
    "S1",
    "S2",
    "S3",
    "S4",
    "S5"
  ],
  "signals_verified": [
    "S1",
    "S2",
    "S3",
    "S5"
  ],
  "valid_until": "2026-08-18T14:53:09Z"
}
